id,name,class,description,entity,attribute,xref
0000173,Soil borne mosaic incidence,BioticStressTrait,Soil borne mosaic incidence in the plants caused by the agent soilborne wheat mosaic virus (sbwmv) which is vectored by Plasmodiophorid polymyxa graminis.,Leaf,Soil borne mosaic incidence,
0000115,Southern blight plant response,BioticStressTrait,Southern blight response in the plants caused by the agent Corticum rolfsii (Sclerotium rolfsii).,Plant,Southern blight plant response,
0000027,Spike awnedness,MorphologicalTrait,Observation of awn type whether awnless/awnletted (short awns)/awned (conspicious awns).,Spike,Awnedness,
0000055,Spike density,MorphologicalTrait,Density or compactness of a wheat spike.,Spike,Density,
0000684,Spike disease development,BioticStressTrait,The plant damage caused by spike diseases.,Spike,Spike disease development,
0000056,Spike length,MorphologicalTrait,Length of spike.,Spike,Length,
0000166,Spike number,AgronomicalTrait,"Number of spikes (fertile culms) per unit area, sample or plant.",Spike,Number,
0000166,Spike number,AgronomicalTrait,"Number of spikes (fertile culms) per unit area, sample or plant.",Spike,Number,
0000057,Spike shattering,AgronomicalTrait,Observation of grains dehiscence from spike at maturity.,Spike,Shattering,
0000659,Spike threshability,MorphologicalTrait,Threshability (ease to thresh) is a score where several spike-related traits such as rachis fragility (brittle or non-brittle rachis) and glume tenacity (hulled or free-threshing).,Spike,Threshability,
0000058,Spikelet number,AgronomicalTrait,Number of spikelets per spike.,Spikelet,Number,
0000912,Spot blotch incidence,BioticStressTrait,Spot blotch incidence in the plants caused by the agent Cochliobolus sativus (helminthosporium sativum).,Leaf,Spot blotch incidence,
0000912,Spot blotch incidence,BioticStressTrait,Spot blotch incidence in the plants caused by the agent Cochliobolus sativus (helminthosporium sativum).,Leaf,Spot blotch incidence,
0000913,Spot blotch legacy,BioticStressTrait,Spot blotch incidence/severity/response in the plants caused by the agent Cochliobolus sativus (helminthosporium sativum).,Leaf,Spot blotch legacy,
0000913,Spot blotch legacy,BioticStressTrait,Spot blotch incidence/severity/response in the plants caused by the agent Cochliobolus sativus (helminthosporium sativum).,Leaf,Spot blotch legacy,
0000723,Spot blotch severity,BioticStressTrait,Spot blotch severity in the plants caused by the agent Cochliobolus sativus (Helminthosporium sativum).,Leaf,Spot blotch severity,
0000723,Spot blotch severity,BioticStressTrait,Spot blotch severity in the plants caused by the agent Cochliobolus sativus (Helminthosporium sativum).,Leaf,Spot blotch severity,
0000081,Sprouting tolerance,AbioticStressTrait,Tolerance of grain to sprout when in the spike.,Grain,Sprouting tolerance,
0000062,Stem diameter,MorphologicalTrait,Stem outer diameter.,Stem,Diameter,
0000060,Stem length,MorphologicalTrait,Length of stem.,Stem,Length,
0000688,Stem rust coefficient of infection,BioticStressTrait,Stem rust (black rust) incidence/severity/response in the plants caused by the agent Puccinia graminis f.sp. tritici.,Plant,Stem rust coefficient of infection,
0000903,Stem rust notes,BioticStressTrait,Stem rust (black rust) incidence/severity/response in the plants caused by the agent Puccinia graminis f.sp. tritici.,Plant,Stem rust notes,
0000177,Stem rust plant response,BioticStressTrait,Stem rust (black rust) response in the plants caused by the agent Puccinia graminis f.sp. tritici.,Plant,Stem rust plant response,
0000904,Stem rust seedling response,BioticStressTrait,Stem rust (black rust) response in the plants caused by the agent Puccinia graminis f.sp. tritici.,Seedling,Stem rust seedling response,
0000905,Stem rust severity,BioticStressTrait,Stem rust (black rust) severity in the plants caused by the agent Puccinia graminis f.sp. tritici.,Plant,Stem rust severity,
0000905,Stem rust severity,BioticStressTrait,Stem rust (black rust) severity in the plants caused by the agent Puccinia graminis f.sp. tritici.,Plant,Stem rust severity,
0000061,Stem solidness,MorphologicalTrait,Solidness of stem.,Stem,Solidness,
0000657,Stem strength,MorphologicalTrait,Strength of the culm.,Stem,Strength,
0000658,Stem wall thickness,MorphologicalTrait,Stem wall thickness.,Stem,Wall thickness,
0000207,Stem water soluble carbohydrate,PhysiologicalTrait,"Water soluble carbohydrates accumulate up to and around anthesis and are partitioned to the stem, from where they are later available as a reservoir for remobilization to the developing grains. These reserves are an important source of carbon for grain filling.",Stem,Water soluble carbohydrate content,
0000165,Spike sterility index,AgronomicalTrait,Spike sterility observed as infertile florets.,Spike,Sterility,
0000165,Spike sterility index,AgronomicalTrait,Spike sterility observed as infertile florets.,Spike,Sterility,
0000689,Stripe rust coefficient of infection,BioticStressTrait,Stripe rust (yellow rust) incidence/severity/response in the plants caused by the agent Puccinia striiformis f.sp. tritici.,Leaf,Stripe rust coefficient of infection,
0000906,Stripe rust incidence,BioticStressTrait,Stripe rust (yellow rust) incidence in the plants caused by the agent Puccinia striiformis f.sp. tritici.,Leaf,Stripe rust incidence,
0000907,Stripe rust notes,BioticStressTrait,Stripe rust (yellow rust) incidence/severity/response in the plants caused by the agent Puccinia striiformis f.sp. tritici.,Leaf,Stripe rust notes,
0000179,Stripe rust plant response,BioticStressTrait,Stripe rust (yellow rust) response in the plants caused by the agent Puccinia striiformis f.sp. tritici.,Leaf,Stripe rust plant response,
0000179,Stripe rust plant response,BioticStressTrait,Stripe rust (yellow rust) response in the plants caused by the agent Puccinia striiformis f.sp. tritici.,Leaf,Stripe rust plant response,
0000908,Stripe rust severity,BioticStressTrait,Stripe rust (yellow rust) severity in the plants caused by the agent Puccinia striiformis f.sp. tritici.,Leaf,Stripe rust severity,
0000908,Stripe rust severity,BioticStressTrait,Stripe rust (yellow rust) severity in the plants caused by the agent Puccinia striiformis f.sp. tritici.,Leaf,Stripe rust severity,
0000909,Stripe rust spike severity,BioticStressTrait,Stripe rust (yellow rust) severity in the plants caused by the agent Puccinia striiformis f.sp. tritici.,Spike,Stripe rust spike severity,
0000094,Suni pest damage,BioticStressTrait,"The plant damage caused by suni pest (Eurygaster spp., sunn pest, suni bug).",Plant,Suni pest damage,
0000119,Take all incidence,BioticStressTrait,Take-all incidence in the plants caused by the agent Gaeumannomyces graminis var. tritici (ggt).,Plant,Take all incidence,
0000119,Take all incidence,BioticStressTrait,Take-all incidence in the plants caused by the agent Gaeumannomyces graminis var. tritici (ggt).,Plant,Take all incidence,
0000910,Tan spot incidence,BioticStressTrait,"Tan spot (Pyrenophora yellow leaf blotch, yellow spot) incidence in the plants caused by the agent Pyrenophora tritici-repentis (helminthosporium tritici-repentis). Symptoms: the lesions appear as tan to brown flecks, which expand into large, irregular, oval- or lens-shaped tan blotches with a yellow or chlorotic margin.",Leaf,Tan spot incidence,
0000910,Tan spot incidence,BioticStressTrait,"Tan spot (Pyrenophora yellow leaf blotch, yellow spot) incidence in the plants caused by the agent Pyrenophora tritici-repentis (helminthosporium tritici-repentis). Symptoms: the lesions appear as tan to brown flecks, which expand into large, irregular, oval- or lens-shaped tan blotches with a yellow or chlorotic margin.",Leaf,Tan spot incidence,
0000345,Tan spot plant response,BioticStressTrait,"Tan spot (Pyrenophora yellow leaf blotch, yellow spot) response in the plants caused by the agent Pyrenophora tritici-repentis (helminthosporium tritici-repentis). Symptoms: the lesions appear as tan to brown flecks, which expand into large, irregular, oval- or lens-shaped tan blotches with a yellow or chlorotic margin.",Leaf,Tan spot plant response,
0000911,Tan spot seedling response,BioticStressTrait,"Tan spot (Pyrenophora yellow leaf blotch, yellow spot) response in the plants caused by the agent Pyrenophora tritici-repentis (helminthosporium tritici-repentis). Symptoms: the lesions appear as tan to brown flecks, which expand into large, irregular, oval- or lens-shaped tan blotches with a yellow or chlorotic margin.",Seedling,Tan spot seedling response,
0000650,Tan spot severity,BioticStressTrait,"Tan spot (Pyrenophora yellow leaf blotch, yellow spot) severity in the plants caused by the agent Pyrenophora tritici-repentis (Helminthosporium tritici-repentis). Symptoms: the lesions appear as tan to brown flecks, which expand into large, irregular, oval- or lens-shaped tan blotches with a yellow or chlorotic margin.",Leaf,Tan spot severity,
0000650,Tan spot severity,BioticStressTrait,"Tan spot (Pyrenophora yellow leaf blotch, yellow spot) severity in the plants caused by the agent Pyrenophora tritici-repentis (Helminthosporium tritici-repentis). Symptoms: the lesions appear as tan to brown flecks, which expand into large, irregular, oval- or lens-shaped tan blotches with a yellow or chlorotic margin.",Leaf,Tan spot severity,
0000940,Terminal spikelet time,PhenologicalTrait,"Terminal spikelet time is when the last spikelet, the terminal spikelet, has been produced.",Plant,Terminal spikelet time,
0000940,Terminal spikelet time,PhenologicalTrait,"Terminal spikelet time is when the last spikelet, the terminal spikelet, has been produced.",Plant,Terminal spikelet time,
0000190,Tiller number,AgronomicalTrait,"Number of total tillers (fertile and infertile) per unit area, sample or plant.",Tiller,Tiller number,
0000190,Tiller number,AgronomicalTrait,"Number of total tillers (fertile and infertile) per unit area, sample or plant.",Tiller,Tiller number,
0000190,Tiller number,AgronomicalTrait,"Number of total tillers (fertile and infertile) per unit area, sample or plant.",Tiller,Tiller number,
0000189,Tillering capacity,AgronomicalTrait,An tillering capacity.,Plant,Tillering capacity,
0000099,Tilletia laevis bunt incidence,BioticStressTrait,"Bunt incidence in the plants caused by the agent Tilletia laevis (stinking bunt, covered smut, hill bunt, complete bunt, low bunt, high bunt).",Spike,Tilletia laevis bunt incidence,
0000100,Tilletia tritici bunt incidence,BioticStressTrait,"Bunt incidence in the plants caused by the agent Tilletia tritici (stinking bunt, covered smut, hill bunt, complete bunt, low bunt, high bunt).",Spike,Tilletia tritici bunt incidence,
0000158,Translocation 1BL/1RS,QualityTrait,The 1bl/1rs translocation in wheat resulted from replacing the short arm of the chromosome 1b of wheat by the short arm of the chromosome 1r of rye (Secale cereale l.).,Translocation 1BL/1RS,Absence/Presence,
0000128,Waterlogging damage,AbioticStressTrait,Plants killed as a result of winter conditions.,Plant,Waterlogging damage,
0000227,Whole meal flour color,QualityTrait,The whole meal flour color.,Whole meal flour,Color,
0000227,Whole meal flour color,QualityTrait,The whole meal flour color.,Whole meal flour,Color,
0000227,Whole meal flour color,QualityTrait,The whole meal flour color.,Whole meal flour,Color,
0000071,Whole meal flour falling number,QualityTrait,"Indication of the amount of sprout damage that has occurred within a wheat sample. falling number value of 350 seconds or longer indicates a low enzyme activity and very sound wheat quality. as the amount of enzyme activity increases, the falling number decreases. Values below 200 seconds indicate high levels of enzyme activity.",Whole meal flour,Falling number,
0000147,Whole meal flour SDS sedimentation,QualityTrait,"Testing of whole-meal flour quality by SDS-sedimentation, a test estimating gluten-protein overall quality.",Whole meal flour,SDS-sedimentation volume,
0000677,Whole meal flour yellow pigment content,QualityTrait,Whole meal flour yellow pigment content due to the presence of xanthophyll and other related compounds.,Whole meal flour,Yellow pigment content,
0000164,Winter kill damage,AbioticStressTrait,Plants killed as a result of winter conditions.,Plant,Winter kill damage,
0000164,Winter kill damage,AbioticStressTrait,Plants killed as a result of winter conditions.,Plant,Winter kill damage,
0000164,Winter kill damage,AbioticStressTrait,Plants killed as a result of winter conditions.,Plant,Winter kill damage,
0000685,Worm damage,BioticStressTrait,The plant damage caused by worms.,Plant,Worm damage,
0000932,Bacterial leaf blight severity,BioticStressTrait,"Wheat bacterial leaf blight severity in the plants caused by the agent Pseudomonas syringae pv. syringae. symptoms: small (less than 0.04 inches) water-soaked lesions expand and eventually coalesce. initial lesions become necrotic and turn from gray-green to tan-white. Entire leaves may become necrotic, but heads and glumes are typically symptomless.",Leaf,Bacterial leaf blight severity,
0000710,Barley scald severity,BioticStressTrait,Barley scald severity in the plants caused by the agent Rhynchosporium secalis.,Plant,Barley scald severity,
0000926,Fusarium graminearum severity,BioticStressTrait,Fusarium graminearum severity in the plants.,Spike,Fusarium graminearum severity,
0000653,Fusarium leaf blotch severity,BioticStressTrait,"Fusarium leaf blotch (pink snow mold, fusarium patch) severity in the plants caused by the agent Calonectria nivalis (fusarium nivale).",Plant,Fusarium leaf blotch severity,
0000686,Helminthosporium species severity,BioticStressTrait,The disease severity in the plants caused by the agent Helminthosporium species.,Plant,Helminthosporium species severity,
0000406,Net blotch severity,BioticStressTrait,Net blotch severity in the plants caused by the agent Pyrenophora teres (Helminthosporium teres).,Leaf,Net blotch severity,
0000939,Powdery mildew severity,BioticStressTrait,Powdery mildew severity in the plants caused by the agent Blumeria graminis (Erysiphe graminis) f. sp. tritici.,Leaf,Powdery mildew severity,
0000714,Septoria blotch severity,BioticStressTrait,Septoria blotch severity in the plants caused by the agent Septoria species.,Leaf,Septoria blotch severity,
0000717,Septoria nodorum blotch severity,BioticStressTrait,Septoria nodorum blotch severity in the plants caused by the agent Stagonospora nodorum (syn. Septoria glume blotch) (Phaeosphaeria nodorum (E. Müller) Hedjaroude (syn. Stagonospora nodorum).,Plant,Septoria nodorum blotch severity,
0000718,Septoria tritici blotch severity,BioticStressTrait,Septoria tritici blotch severity in the plants caused by the agent Mycosphaerella graminicola (Septoria tritici). symptoms: the lesions are linear and restricted laterally.,Plant,Septoria tritici blotch severity,
0000723,Spot blotch severity,BioticStressTrait,Spot blotch severity in the plants caused by the agent Cochliobolus sativus (Helminthosporium sativum).,Leaf,Spot blotch severity,
0000650,Tan spot severity,BioticStressTrait,"Tan spot (Pyrenophora yellow leaf blotch, yellow spot) severity in the plants caused by the agent Pyrenophora tritici-repentis (Helminthosporium tritici-repentis). Symptoms: the lesions appear as tan to brown flecks, which expand into large, irregular, oval- or lens-shaped tan blotches with a yellow or chlorotic margin.",Leaf,Tan spot severity,
0001031,Wheat blast severity,BioticStressTrait,"Wheat blast severity in the spikes caused by the agent Magnaporthe grisea (Pyricularia oryzae). Symptoms: It can infect all above-ground parts of the wheat plant, but head blast, resembling Fusarium head blight in appearance, is the most common symptom in the field. Infected spikes become bleached and produce small shriveled seed or none at all.",Spike,Wheat blast severity,
0001032,Forage dry matter,AgronomicalTrait,Forage dry matter.,Plant,Forage dry matter,
0000963,Winter survival,AbioticStressTrait,"Ability to survive or withstand cold temperatures in the late fall, winter, or early spring.",Plant,Winter survival,
0000960,Awn color,MorphologicalTrait,Awn color.,Awn,Color,
0000961,Canopy green normalized difference vegetation index,PhysiologicalTrait,Normalized difference vegetation index is used to measure vegetative greenness and canopy photosynthetic size.,Canopy,Normalized difference vegetation index,
0000962,Canopy red normalized difference vegetation index,PhysiologicalTrait,Normalized difference vegetation index is used to measure vegetative greenness and canopy photosynthetic size.,Canopy,Normalized difference vegetation index,
0000966,Grain amylopectin content,QualityTrait,Content of amylopectin in grain.,Grain,Amylopectin content,
0000967,Grain lysine content,QualityTrait,Lysine content of the kernel/grain.,Grain,Lysine content,
0000970,Rachis length,MorphologicalTrait,Length of rachis.,Rachis,Length,
0000971,Spike type,MorphologicalTrait,Shape characteristics of typical mature spikes.,Spike,Type,
0000972,Stand establishment,AgronomicalTrait,Measurement of plant emergence and vigor in the field.,Plant,Establish,
0000973,Stem color,MorphologicalTrait,Color of the stems.,Stem,Color,
0000974,Straw breakage,AgronomicalTrait,Amount of straw breakage.,Straw,Breakage,
0000975,Straw color,MorphologicalTrait,Color of straw.,Straw,Color,
0000976,Straw strength,AgronomicalTrait,Strength of straw.,Straw,Strength,
0000977,Straw yield,AgronomicalTrait,Amount (weight) of straw.,Straw,Yield,
0000978,Whole meal flour ash content,QualityTrait,Ash content in flour.,Whole meal flour,Ash content,
0000979,Grain length,QualityTrait,Length of whole grain.,Grain,Length,
0000980,Grain width,QualityTrait,Width of whole grain.,Grain,Width,
0000981,Grain thickness,QualityTrait,Thickness of whole grain.,Grain,Thickness,
0000040,Grain size,MorphologicalTrait,Grain size.,Grain,Size,
0000040,Grain size,MorphologicalTrait,Grain size.,Grain,Size,
0000040,Grain size,MorphologicalTrait,Grain size.,Grain,Size,
0000040,Grain size,MorphologicalTrait,Grain size.,Grain,Size,
0000040,Grain size,MorphologicalTrait,Grain size.,Grain,Size,
0000040,Grain size,MorphologicalTrait,Grain size.,Grain,Size,
0000040,Grain size,MorphologicalTrait,Grain size.,Grain,Size,
0000040,Grain size,MorphologicalTrait,Grain size.,Grain,Size,
0000040,Grain size,MorphologicalTrait,Grain size.,Grain,Size,
0000040,Grain size,MorphologicalTrait,Grain size.,Grain,Size,
0000040,Grain size,MorphologicalTrait,Grain size.,Grain,Size,
0000040,Grain size,MorphologicalTrait,Grain size.,Grain,Size,
0000982,Anther extrusion,AgronomicalTrait,Extrusion of anthers.,Anther,Anther extrusion,
0000982,Anther extrusion,AgronomicalTrait,Extrusion of anthers.,Anther,Anther extrusion,
0001484,Infertile spike number,AgronomicalTrait,Number of infertile spikelet per spike.,Spike,Number,
0001485,Rapid spike growth period,PhenologicalTrait,Rapid spike growth period.,Canopy,Grain Filling duration,
0000407,Crop growth rate,PhysiologicalTrait,It is the rate of dry matter production per unit area.,Plant,Biomass production,
0000166,Spike number,AgronomicalTrait,"Number of spikes (fertile culms) per unit area, sample or plant.",Spike,Number,
0001486,Grain yield production rate,AgronomicalTrait,Grain yield production rate.,Grain,Yield production rate,
0001487,Biomass production rate,AgronomicalTrait,Biomass production rate.,Biomass,Production per day,
0001488,Terminal spikelet thermal time,PhenologicalTrait,Thermal Time from emergence to Terminal Spikelet (GS30).,Plant,Terminal spikelet thermal time,
0001489,Booting initiation thermal time,PhenologicalTrait,Thermal Time from emergence  to Initiation of Booting (GS41).,Plant,Initiation of Booting thermal time,
0001490,Booting thermal time,PhenologicalTrait,Thermal Time from emergence  to Booting  (GS45).,Plant,Booting thermal time,
0001491,Heading thermal time,PhenologicalTrait,Thermal Time  from emergence to Heading (GS55).,Plant,Heading thermal time,
0001492,Anthesis thermal time,PhenologicalTrait,Thermal Time from emergence  to Anthesis (GS65).,Plant,Anthesis thermal time,
0001493,Physiological maturity thermal time,PhenologicalTrait,Thermal Time  from emergence to Physiological Maturity (GS87).,Plant,Physiological maturity thermal time,
0000207,Stem water soluble carbohydrate,PhysiologicalTrait,"Water soluble carbohydrates accumulate up to and around anthesis and are partitioned to the stem, from where they are later available as a reservoir for remobilization to the developing grains. These reserves are an important source of carbon for grain filling.",Stem,Water soluble carbohydrate content,
0000207,Stem water soluble carbohydrate,PhysiologicalTrait,"Water soluble carbohydrates accumulate up to and around anthesis and are partitioned to the stem, from where they are later available as a reservoir for remobilization to the developing grains. These reserves are an important source of carbon for grain filling.",Stem,Water soluble carbohydrate content,
0001494,Spike photosynthesis contribution,PhysiologicalTrait,Photosynthetic contribution of the spike (ear) to grain yield.,Spike,Spike Photosynthesis,
0001495,Fruiting efficiency,PhysiologicalTrait,"The final outcome of the floret developmental rates (determining the number of floret primordia that reach the stage of fertile florets at anthesis) and the proportion of grain set per fertile floret (the opposite to grain abortion), per unit of spike weight.",Spike,Fruiting efficiency,
0001496,Spike partitioning index,PhysiologicalTrait,Spike partitioning index.,Spike,Partitioning index,
0001497,Leaf lamina partitioning index,PhysiologicalTrait,Leaf lamina partitioning index.,Leaf,Lamina partitioning index,
0001498,Leaf sheath partitioning index,PhysiologicalTrait,Leaf sheath partitioning index.,Leaf,Sheath partitioning index,
0001499,True stem partitioning index,PhysiologicalTrait,True stem partitioning index.,Stem,True stem partitioning index,
0001500,Specific leaf area,PhysiologicalTrait,A ratio of the leaf area to dry mass.,Leaf,Specific leaf area,
0001501,Leaf net photosynthesis rate,PhysiologicalTrait,Carbon fixation by photosynthesis.,Leaf,Net photosynthesis rate,
0001502,Leaf light-saturated net photosynthesis,PhysiologicalTrait,Carbon fixation by photosynthesis at saturating light.,Leaf,Light-saturated net photosynthesis,
0001503,Leaf light and carbon dioxide-saturated net photosynthesis,PhysiologicalTrait,Carbon fixation by photosynthesis at saturating light and CO2.,Leaf,Light and carbon dioxide-saturated net photosynthesis,
0001504,Leaf intercellular carbon dioxide concentration,PhysiologicalTrait,Intercellular carbon dioxide concentration.,Leaf,Intercellular carbon dioxide concentration,
0001505,Leaf quantum yield of photosystem II,PhysiologicalTrait,Quantum yield of electron transfer at PSII.,Leaf,Quantum yield of photosystem II,
0001506,Leaf quantum yield of carbon dioxide fixation,PhysiologicalTrait,Quantum yield of carbon dioxide (CO2) fixation.,Leaf,Quantum yield of carbon dioxide fixation,
0001507,Leaf electron transport rate,PhysiologicalTrait,Transfer of electrons during photosynthesis in light saturated leaf.,Leaf,Electron transport rate,
0001508,Leaf maximal fluorescence intensity,PhysiologicalTrait,Maximal level of fluorescence intensity measured in the leaf.,Leaf,Maximal fluorescence intensity,
0001508,Leaf maximal fluorescence intensity,PhysiologicalTrait,Maximal level of fluorescence intensity measured in the leaf.,Leaf,Maximal fluorescence intensity,
0001509,Leaf minimal fluorescence intensity,PhysiologicalTrait,Minimal level of fluorescence intensity measured in the leaf.,Leaf,Minimal fluorescence intensity,
0001509,Leaf minimal fluorescence intensity,PhysiologicalTrait,Minimal level of fluorescence intensity measured in the leaf.,Leaf,Minimal fluorescence intensity,
0001510,leaf variable fluorescence,PhysiologicalTrait,Variable fluorescence measured in the leaf.,Leaf,Variable fluorescence,
0001510,leaf variable fluorescence,PhysiologicalTrait,Variable fluorescence measured in the leaf.,Leaf,Variable fluorescence,
0001511,leaf maximum efficiency of PSII photochemistry,PhysiologicalTrait,Maximum quantum yield of PSII measured in the leaf.,Leaf,Maximum efficiency of PSII photochemistry,
0001511,leaf maximum efficiency of PSII photochemistry,PhysiologicalTrait,Maximum quantum yield of PSII measured in the leaf.,Leaf,Maximum efficiency of PSII photochemistry,
0001512,Leaf steady-state fluorescence,PhysiologicalTrait,The fluorescence emitting during steady state.,Leaf,Steady-state fluorescence,
0001513,Leaf transpiration rate,PhysiologicalTrait,Leaf transpiration rate.,Leaf,Leaf transpiration rate,
0001514,Leaf intercellular to ambient carbon dioxide ratio,PhysiologicalTrait,Intercellular to ambient carbon dioxide ratio.,Leaf,Intercellular to ambient carbon dioxide ratio,
0001515,Canopy light interception,PhysiologicalTrait,Light energy intercepted by the canopy.,Canopy,Light interception,
0001516,Radiation use efficiency,PhysiologicalTrait,The amount of biomass produced per unit of intercepted solar radiation.,Canopy,Radiation Use Efficiency,
0001516,Radiation use efficiency,PhysiologicalTrait,The amount of biomass produced per unit of intercepted solar radiation.,Canopy,Radiation Use Efficiency,
0001517,Pigment simple ratio chlorophyll a,PhysiologicalTrait,Chlorophyll content in leaf green tissue. It includes ONLY chlorophyll-a. Chlorophyll is the green pigment found in plants.,Leaf,Chlorophyll content,
0001518,Pigment simple ratio chlorophyll b,PhysiologicalTrait,Chlorophyll content in leaf green tissue. It includes ONLY chlorophyll-b. Chlorophyll is the green pigment found in plants.,Leaf,Chlorophyll content,
0001519,Leaf spectral reflectance 675 nm,PhysiologicalTrait,The normalized amount of electromagnetic radiation that is reflected by the leaf at R675 nm wavelength.,Leaf,Spectral reflectance,
